{
  "$schema": "./schema/pack.schema.json",
  "name": "Batman",
  "icon": "bat_signal.jpg",
  "enabled": true,

  "wordpacks": [
    {
      "name": "batman_villains",
      "enabled": true,
      "nouns": [
        { "word": "Joker", "forms": ["Joker"] },
        { "word": "villain", "forms": ["villain, villains"] }
      ],

      "verbs": [
        { "word": "fly", "forms": ["fly", "flown", "flew"] },
        { "word": "dance", "forms": ["dance", "danced"] },
        { "word": "steal", "forms": ["steal", "stole"] },
        { "word": "laugh", "forms": ["laugh", "laughed", "laughing"] },
        { "word": "hide", "forms": ["hide", "hid", "hiding"] }
      ],

      "adjectives": [
        { "word": "evil", "forms": ["evil"] },
        { "word": "sad", "forms": ["sad"] }
      ],

      "misc": [{ "word": "the", "forms": ["the"] }]
    },

    {
      "name": "batman_basics",
      "enabled": true,
      "nouns": [
				{ "word": "Batman", "forms": ["Batman"] },
				{ "word": "Robin", "forms": ["Robin"] }
			],

      "verbs": [
        { "word": "fly", "forms": ["fly", "flown", "flew"] },
        { "word": "dance", "forms": ["dance", "danced"] }
      ],

      "adjectives": [{ "word": "brave", "forms": ["brave"] }],
      "misc": []
    }
  ]
}
