{
  "$schema": "./schema/pack.schema.json",
  "name": "Jojo Siwa",
  "icon": "jojo.png",
  "enabled": true,
  "wordpacks": [
    {
      "name": "jojo",
      "enabled": true,

      "nouns": [
        { "word": "JoJo", "forms": ["JoJo"] },
        { "word": "artist", "forms": ["artist", "artists"] },
        {
          "word": "boomerang",
          "forms": ["boomerang", "boomerangs", "Boomerang"]
        },
        { "word": "bow", "forms": ["bow", "bows", "BowBow"] },
        { "word": "candy", "forms": ["candy", "candies"] },
        { "word": "competition", "forms": ["competition", "competitions"] },
        { "word": "confidence", "forms": ["confidence"] },
        { "word": "dancer", "forms": ["dancer", "dancers"] },
        { "word": "drama", "forms": ["drama"] },
        { "word": "fashion", "forms": ["fashion", "fashions"] },
        { "word": "girl", "forms": ["girl", "girls"] },
        { "word": "friendship", "forms": ["friendship"] },
        { "word": "kid", "forms": ["kid", "kids"] },
        { "word": "kiss", "forms": ["kisses"] },
        { "word": "mom", "forms": ["mom", "moms"] },
        { "word": "music", "forms": ["music"] },
        { "word": "pageant", "forms": ["pageant", "pageants"] },
        { "word": "power", "forms": ["power"] },
        { "word": "puppy", "forms": ["puppy", "puppies"] },
        { "word": "rainbow", "forms": ["rainbow", "rainbows"] },
        { "word": "show", "forms": ["show", "shows"] },
        { "word": "singer", "forms": ["singer", "singers"] },
        { "word": "song", "forms": ["song", "songs"] },
        { "word": "stage", "forms": ["stage", "stages"] },
        { "word": "store", "forms": ["store", "stores"] },
        { "word": "thing", "forms": ["thing", "things"] },
        { "word": "video", "forms": ["video", "videos"] },
        { "word": "vlog", "forms": ["vlog", "vlogs"] },
        { "word": "vlogger", "forms": ["vlogger", "vloggers"] },
        { "word": "word", "forms": ["word", "words"] }
      ],

      "verbs": [
        { "word": "dance", "forms": ["dance", "dances", "danced", "dancing"] },
        {
          "word": "dream",
          "forms": ["dream", "dreams", "dreamed", "dreaming"]
        },
        { "word": "get", "forms": ["get", "gets", "got", "getting"] },
        { "word": "hold", "forms": ["hold", "holds", "held", "holding"] },
        {
          "word": "laugh",
          "forms": ["laugh", "laughs", "laughed", "laughing"]
        },
        { "word": "like", "forms": ["like", "likes", "liked", "liking"] },
        { "word": "love", "forms": ["love", "loves", "loved", "loving"] },
        { "word": "make", "forms": ["make", "makes", "made", "making"] },
        { "word": "play", "forms": ["play", "plays", "played", "playing"] },
        {
          "word": "sing",
          "forms": ["sing", "sings", "sang", "sung", "singing"]
        },
        {
          "word": "thank",
          "forms": ["thank", "thanks", "thanked", "thanking"]
        },
        { "word": "win", "forms": ["win", "wins", "won", "winning"] }
      ],

      "adjectives": [
        { "word": "best", "forms": ["best"] },
        { "word": "colorful", "forms": ["colorful"] },
        { "word": "confident", "forms": ["confident"] },
        { "word": "dazzling", "forms": ["dazzling"] },
        { "word": "delightful", "forms": ["delightful"] },
        { "word": "exciting", "forms": ["exciting"] },
        { "word": "fun", "forms": ["fun"] },
        { "word": "good", "forms": ["good"] },
        { "word": "happy", "forms": ["happy", "happier", "happiest"] },
        { "word": "important", "forms": ["important"] },
        { "word": "impressive", "forms": ["impressive"] },
        { "word": "joyful", "forms": ["joyful"] },
        { "word": "kind", "forms": ["kind", "kindest"] },
        { "word": "posh", "forms": ["posh"] },
        { "word": "powerful", "forms": ["powerful"] },
        { "word": "sweet", "forms": ["sweet", "sweeter", "sweetest"] }
      ],

      "misc": [
        { "word": "most", "forms": ["most"] },
        { "word": "with", "forms": ["with"] },
        { "word": "her", "forms": ["her"] }
      ]
    }
  ]
}
